<?xml version="1.0" encoding="UTF-8" standalone="no"?>
<!DOCTYPE student SYSTEM "dtd/student.dtd">
<?xml-stylesheet href="css/style.css"?>

<student format="full">
    <personalInfo lname="Spada" fname="Brandon" mname="R" email="sample@sample.com" phone="888-888-8888" id="a_1f">
        <creates initEnrollment="10/21/2016">
            <academicInfo advisor="Dr. Rosiene" expectedgrad="2020" major="Computer Science" status="Senior" id="alb_1">
                <grades gpa="3.49" id="g_19920">
                    <data year="2017" semester="Fall" gpa="4.00"/>
                    <data year="2018" semester="Spring" gpa="3.33"/>
                    <data year="2018" semester="Fall" gpa="3.66"/>
                </grades>
            </academicInfo>
        </creates>
    </personalInfo>
</student>